{"$defs":{"FixtureManifestEntry":{"additionalProperties":false,"properties":{"path":{"minLength":1,"pattern":"^(?!/)(?![A-Za-z]:)(?!.*\\\\)(?!.*(?:^|/)(?:\\.{1,2})(?:/|$))(?!.*//).+$","title":"Path","type":"string"},"purpose":{"maxLength":65536,"minLength":1,"title":"Purpose","type":"string"},"schema_ref":{"anyOf":[{"minLength":1,"pattern":"^(?!/)(?![A-Za-z]:)(?!.*\\\\)(?!.*(?:^|/)(?:\\.{1,2})(?:/|$))(?!.*//).+$","type":"string"},{"type":"null"}],"title":"Schema Ref"},"sha256":{"pattern":"^[0-9a-f]{64}$","title":"Sha256","type":"string"},"size":{"minimum":0,"title":"Size","type":"integer"}},"required":["path","purpose","schema_ref","size","sha256"],"title":"FixtureManifestEntry","type":"object"}},"$schema":"https://json-schema.org/draft/2020-12/schema","additionalProperties":false,"properties":{"files":{"items":{"$ref":"#/$defs/FixtureManifestEntry"},"title":"Files","type":"array"},"owner_spec":{"enum":["S00","S01","S02","S03","S04","S05","S06","S07","S08"],"title":"Owner Spec","type":"string"},"root":{"minLength":1,"pattern":"^(?!/)(?![A-Za-z]:)(?!.*\\\\)(?!.*(?:^|/)(?:\\.{1,2})(?:/|$))(?!.*//).+$","title":"Root","type":"string"},"schema_version":{"const":1,"title":"Schema Version","type":"integer"}},"required":["schema_version","owner_spec","root","files"],"title":"FixtureManifest","type":"object"}
