{"files":[{"path":"fake/archive.bin","purpose":"Deterministic opaque attachment payload consumed by the fake Logparse parser.","schema_ref":null,"sha256":"877b9e7cb1e9c83bd1b14259f03b32323a6d2e9b986617c3f94159b94591ca88","size":25},{"path":"fake/client.log","purpose":"Synthetic client-side RPC deadline log used by Logparse evidence tests.","schema_ref":null,"sha256":"4cbf9f4a3e5aa5f05491e5ef779918dc7dd5b94815a835ba13cc9c3999423527","size":159},{"path":"fake/expected-parse-counter.json","purpose":"Expected single-parse invocation count for fake broker acceptance tests.","schema_ref":null,"sha256":"d394e8ae7989458b8c2686297a031614609cefeff2c8e76cdfb352e0655662a3","size":18},{"path":"fake/expected-target-logs.json","purpose":"Expected normalized dual-anchor target-log selection from the fake Logparse CLI.","schema_ref":null,"sha256":"30181cccb748a3211da45e129a617054f7aa4fe2479687d5b5881dd06dda20d6","size":621},{"path":"fake/repo/cli.py","purpose":"Deterministic executable stand-in for the pinned external Logparse CLI.","schema_ref":null,"sha256":"1d21d17f3b41c7a94592f07a60896b545b8c01eafc2d5725fb0e11f69a6981b2","size":10606},{"path":"fake/repo/config.yaml","purpose":"Minimal fake Logparse configuration with the frozen compact product and archive formats.","schema_ref":null,"sha256":"1289d6979f4d0dde06a0c6958fb4e8cbf284735c77f85d34678baa330d99f9a4","size":232},{"path":"fake/server.log","purpose":"Synthetic server-side RPC connection-pool log used by Logparse evidence tests.","schema_ref":null,"sha256":"2104487f25fd81f6035aaad2675d091d77818771b9cb6af011352723c96d6619","size":229},{"path":"real/compact-package-20260103.zip.b64","purpose":"Base64-encoded compact package used to exercise the pinned real Logparse checkout.","schema_ref":null,"sha256":"bf087d3f3b437ec3f04c41cd8bce3c7eb7019c370d39ff2f0b64384008867058","size":1930},{"path":"real/synthetic-rpc-service-takeover.zip.b64","purpose":"Base64-encoded synthetic two-anchor RPC archive for the real Logparse acceptance gate.","schema_ref":null,"sha256":"9161aa8ede7d6bc7cedefd9588b94dc5370112c44394911092dc6cd7da7c1f9e","size":3198},{"path":"source-copy.json","purpose":"Auditable source inventory and hashes for the copied wiki-to-diagnosis generator skill.","schema_ref":null,"sha256":"177242a3446e6bf98b4f39abc34d1ddd4b3aea34c79b0359ba06f6e76e9973db","size":5397},{"path":"supported-formats.json","purpose":"Frozen content-type and filename-suffix mapping supplied to generated diagnosis skills.","schema_ref":null,"sha256":"ec1670ea9814ec2b48909dddc02986561d1f2979e6976041bc171ffb47bbf952","size":396},{"path":"wiki/service-takeover.md","purpose":"Synthetic service-takeover diagnosis wiki input for deterministic skill generation.","schema_ref":null,"sha256":"cfbc83bceebe82ee7670dde3c89e9143addeaf27de52cbb371adfa0f761bb4cc","size":20406}],"owner_spec":"S07","root":"tests/fixtures/components/logparse","schema_version":1}
