{"files":[{"path":"saved-run/task-0001/parse_manifest.json","purpose":"Opaque saved LOGPARSE_RUN directory used only to verify fixed-ref read-only materialization and manifest metadata.","schema_ref":null,"sha256":"885de0f9bd290bc0cfd5c0668c429bb4dabbbfcc5461c4c8be9b9daab16a56a1","size":71}],"owner_spec":"S04","root":"tests/fixtures/components/runtime-logparse","schema_version":1}
