{"files":[{"path":"claude-command-golden.json","purpose":"Golden CLAUDE_COMMAND tokenization, leading environment, inheritance, sanitization, quoting, and Windows shim cases.","schema_ref":null,"sha256":"80d610d92b3dcc38f085d29f48ab3b93913b10458662be647508a7c4cbb48e37","size":2011}],"owner_spec":"S04","root":"tests/fixtures/components/runtime-command","schema_version":1}
