{"files":[{"path":"logparse-tool/product.txt","purpose":"Fake fingerprinted LOGPARSE_TOOL product root used to bind the catalog to a broker factory.","schema_ref":null,"sha256":"0ae6194648b3839474d8cec0bbbd52960cd5a1d6b49efe4fc22c01aae6a8d280","size":36},{"path":"skill-dir/manual-triage/package/manual-triage/SKILL.md","purpose":"Generated Methods Skill entry document for non-Logparse manual triage.","schema_ref":null,"sha256":"49c83edece5c9b3154f5dfa3c44eed4c6058cc2f93a1f653a27ef67af2d11078","size":706},{"path":"skill-dir/manual-triage/package/manual-triage/methods.json","purpose":"Strict Methods Skill index for non-Logparse manual triage.","schema_ref":null,"sha256":"d448bf20f6effb3e18c881ff81cebc63c1cd2fd86b52c342e24d613f541a9d88","size":635},{"path":"skill-dir/manual-triage/package/manual-triage/references/service-boundary-failure.md","purpose":"Independently loadable manual-triage method card.","schema_ref":null,"sha256":"dbfe5b2bf7359aa65dd87c342af347d77f6f7af29fea9379429cf7444106abb4","size":487},{"path":"skill-dir/manual-triage/package/manual-triage/references/shared-boundaries.md","purpose":"Shared non-Logparse evidence boundary.","schema_ref":null,"sha256":"30295a57f123d441e4af33ce57d6e6eebf23bea06f55e71b639ebc5c004ddcc7","size":81},{"path":"skill-dir/manual-triage/package/manual-triage/references/source-log-templates.md","purpose":"Canonical source-template inventory for manual triage.","schema_ref":null,"sha256":"8792af774933c46b23c83819b7f94066f07dd0f4deca2989b2cd39921e60b49c","size":49},{"path":"skill-dir/manual-triage/registration-template.json","purpose":"Product-owned registration for the manual-triage Methods package.","schema_ref":null,"sha256":"74b608cd3c7e4329000d57e09f91a09beaa9a04dba5e7eaf683bfc7bde0d6cad","size":1259},{"path":"skill-dir/non-routable-client/README.md","purpose":"Direct SKILL_DIR child without a registration template, proving unrelated directories are not routed.","schema_ref":null,"sha256":"2982cd7cd4c8e724e9d0b36cd78156077873dfc01275a6004cdc9efbb527e71c","size":132},{"path":"skill-dir/rpc-log-analysis/package/rpc-log-analysis/SKILL.md","purpose":"Generated Methods Skill entry document for RPC target logs.","schema_ref":null,"sha256":"0b18c1792fe80482102fa22ae4b4ff863b91652259c6836a599696b318384792","size":702},{"path":"skill-dir/rpc-log-analysis/package/rpc-log-analysis/methods.json","purpose":"Strict Methods Skill index for RPC log analysis.","schema_ref":null,"sha256":"59ffd39d3ce5b3614f6df2e0d179a2b042c91a998d04e9589a4e72da1d19660b","size":807},{"path":"skill-dir/rpc-log-analysis/package/rpc-log-analysis/references/rpc-call-timeout.md","purpose":"Independently loadable RPC timeout method card.","schema_ref":null,"sha256":"aa6b6df51dd3dbe896179db521c6030dc9ea347a669f46c32d5fcd2b8d094679","size":591},{"path":"skill-dir/rpc-log-analysis/package/rpc-log-analysis/references/shared-boundaries.md","purpose":"Shared RPC timeout safety boundary.","schema_ref":null,"sha256":"6bbb4d567d22321231fa442c4909a38d3a50e070951ad58cec8b3b59a693f6be","size":94},{"path":"skill-dir/rpc-log-analysis/package/rpc-log-analysis/references/source-log-templates.md","purpose":"Canonical source-template inventory for RPC log analysis.","schema_ref":null,"sha256":"919dd49666274ade29f12ae2e1970e88058fca14e76707b2ac44b4fa88e2e55c","size":79},{"path":"skill-dir/rpc-log-analysis/registration-template.json","purpose":"Product-owned registration and Logparse binding for the RPC Methods package.","schema_ref":null,"sha256":"ccfc11f6bb29d48a9028971912ce86bead5347ed3752a3aae1fb7549fdc6d830","size":2446}],"owner_spec":"S04","root":"tests/fixtures/components/runtime-catalog","schema_version":1}
