{"files":[{"path":"contract-blockers.json","purpose":"Records every S03 contract change resolved by the frozen r3 contract.","schema_ref":null,"sha256":"b60fb354926a896fef42af2890a6415594877faf1baaa0eedf25f7f4e24c13d9","size":1303},{"path":"scenario-matrix.json","purpose":"Indexes core S03 production scenarios and their expected disposition or error without duplicating public DTOs.","schema_ref":null,"sha256":"47eea67aa9788f9c98b2ca4f204fc608c95a3e289b6b6ddc46dec3c809e3b2bc","size":4746}],"owner_spec":"S03","root":"tests/fixtures/components/application","schema_version":1}
