{"files":[{"path":"candidate-review-sequence.json","purpose":"Deterministic Candidate plus new Evidence and USER_RESULT acceptance through independent REVIEW PASS.","schema_ref":null,"sha256":"5f10f0b1549ee4868f570460391e21a91e1d22aafc07e4b7ad3e222e9f89766c","size":767},{"path":"control-recovery-sequence.json","purpose":"Stable-target refusal, PENDING redispatch ownership, old-epoch interruption, and same-stage REVIEW replacement.","schema_ref":null,"sha256":"399e3f1acd5ae873401303407139806a687ff1384ab2dd3eab1714088461985a","size":579},{"path":"failure-status-matrix.json","purpose":"Closed fatal and conditional failure sets plus the complete domain status-trigger partition.","schema_ref":null,"sha256":"aa73cbaf52602eb29121fc32d97e9f9498327d2771103afb867e3209bf36fc79","size":1331},{"path":"finalized-semantic-rejection-sequence.json","purpose":"Trigger-specific Coordinator errors and deterministic two-stage OUTCOME_INVALID termination with STALE and REJECTED ownership boundaries.","schema_ref":null,"sha256":"d45a0a34aa6ff39a779a18bac8fb072e6137066eaefafc21d71492eeabf74a1a","size":1877},{"path":"review-rework-sequence.json","purpose":"REVIEW NEED_MORE_EVIDENCE and REJECT recovery with fixed incoming previous Outcome.","schema_ref":null,"sha256":"d860d1f0f04fbbc2b2be4dbe7458d37b2d38019e6b95d56c6a440af9374bf475","size":1051},{"path":"routing-supplement-logparse-sequence.json","purpose":"RPC timeout routing, parameter groups A and B, unique log requirement, and fixed LOGPARSE continuation.","schema_ref":null,"sha256":"9ff5bd81c14d4866872bf70b27a77a32385f9575b50357d392e700cb42e3a0a6","size":1407}],"owner_spec":"S01","root":"tests/fixtures/components/domain","schema_version":1}
