{"files":[{"path":"SKILL.md","purpose":"TEST_ONLY dual-mode generic locator Skill with explicit native, V1 compatibility, and V2 framework routing.","schema_ref":null,"sha256":"913b91d118a801c7d4c70acde987f3df189994c06e955dade47475cce35d4783","size":2626},{"path":"references/native-report.md","purpose":"Canonical rich Markdown native/V2 report oracle used for byte-preservation and local A/B tests.","schema_ref":null,"sha256":"ae0607ac3b330185181bb527cca05dba54d961c870ec841838cd73efa83ff2d5","size":812},{"path":"references/v1-result.txt","purpose":"Canonical V1 compatibility result for the same controlled problem input.","schema_ref":null,"sha256":"01ea5a0b0574185546e11aae33a476afcf858cda92aa53008cd748b78630d012","size":374},{"path":"scripts/run_fixture_modes.py","purpose":"TEST_ONLY no-model driver that executes the fixture's frozen DIRECT, V1, and V2 branches.","schema_ref":null,"sha256":"68fc6ce0611ac7eaec43eb45ca10e8315821c6926aff76f0a371e11b9e467049","size":5449}],"owner_spec":"S08","root":"tests/fixtures/components/generic-problem-locator-dual-mode","schema_version":1}
