{"files":[{"path":"failure-matrix.json","purpose":"Drives S08 cross-module assertions for replace-boundary delivery policy, deterministic failure mapping, late-outcome classification, and old-epoch recovery.","schema_ref":null,"sha256":"3564e50f4afa8c8b09d60c1722addb1619ad8f5f21e24e5b4e4797465259271d","size":2116}],"owner_spec":"S08","root":"tests/fixtures/failures","schema_version":1}
