{"files":[{"path":"negative/model-agent-outcome-payload-error-conflict.json","purpose":"Negative rejection fixture for model-agent-outcome-payload-error-conflict.json.","schema_ref":"schemas/v2/agent-job-outcome.schema.json","sha256":"f3c7223c609bdc4d72eaf5db716448e9faa9d575c988634fac6d44159c8bf8dc","size":720},{"path":"negative/model-job-stale-status.json","purpose":"Negative rejection fixture for model-job-stale-status.json.","schema_ref":"schemas/v2/job.schema.json","sha256":"8493537d4ab618808db320fe72710f8120a5b681b911498d53a9501bc1ac4265","size":1952},{"path":"negative/model-review-pass-with-missing-evidence.json","purpose":"Negative rejection fixture for model-review-pass-with-missing-evidence.json.","schema_ref":"schemas/v2/agent-job-outcome.schema.json","sha256":"181b050af88135e88d245f5355cf133ba3dda913da9785e78c097b7bccced8c7","size":927},{"path":"negative/model-workspace-archive-path-drift.json","purpose":"Reject attachment workspace paths that drift from the frozen filename suffix.","schema_ref":"schemas/v2/workspace-input-manifest.schema.json","sha256":"98f97a8a212bfff900d1922b8a62cf5677c41beb5fc763097e76ab018ef4b069","size":536},{"path":"negative/model-workspace-archive-suffix-mismatch.json","purpose":"Reject attachment archive suffixes that do not match the canonical content type.","schema_ref":"schemas/v2/workspace-input-manifest.schema.json","sha256":"2b6d33bf70af169156761d7e7bb05358e858e134ec840b5ef10cc0c8612da6a6","size":537},{"path":"negative/model-workspace-content-type-uppercase.json","purpose":"Negative rejection fixture for model-workspace-content-type-uppercase.json.","schema_ref":"schemas/v2/workspace-input-manifest.schema.json","sha256":"9d9d4dd74b9fdb89188859b4de31ec054c49d0457c0e0fc245f83cbe0f1af0fe","size":543},{"path":"negative/schema-fixture-manifest-traversal.json","purpose":"Negative rejection fixture for schema-fixture-manifest-traversal.json.","schema_ref":"schemas/v2/fixture-manifest.schema.json","sha256":"ecf57223840f2d3081ec790dbe74eed731a4cd9c8d4d654ffd7e0248a17a6241","size":268},{"path":"negative/schema-handoff-invalid-hash.json","purpose":"Negative rejection fixture for schema-handoff-invalid-hash.json.","schema_ref":"schemas/v2/handoff.schema.json","sha256":"f6f9fdfba7d6f7fe669f086fb49fef2fb348641e62b29d63839ca720839e7f25","size":524},{"path":"negative/schema-handoff-nested-extra-field.json","purpose":"Negative rejection fixture for schema-handoff-nested-extra-field.json.","schema_ref":"schemas/v2/handoff.schema.json","sha256":"40794a81e69c1fd9055067d3b6eb7b68aa841d663ad8342b90a35c444cdd2578","size":572},{"path":"negative/schema-logparse-claim-extra-field.json","purpose":"Negative rejection fixture for schema-logparse-claim-extra-field.json.","schema_ref":"schemas/v2/logparse-parse-claim.schema.json","sha256":"222d3d1186c20674b87dd2cea3e0b04b9f7cf5d83eec4d995e375330021b1c36","size":492},{"path":"negative/schema-user-result-extra-field.json","purpose":"Negative rejection fixture for schema-user-result-extra-field.json.","schema_ref":"schemas/v2/user-result.schema.json","sha256":"e69d6ab69a7139c316d31e380f46ff0cadb4c6b1d80731c88e6c5bab8d3b5692","size":2319},{"path":"negative/schema-user-result-inconclusive-empty-gaps.json","purpose":"Reject INCONCLUSIVE USER_RESULT when evidence_gaps is empty even if limitations is non-empty.","schema_ref":"schemas/v2/user-result.schema.json","sha256":"dbc4bd50957fc4b0283e31c601b707d91ad2175c2407e436e1621cb690ac2de3","size":1792},{"path":"positive/agent-job-outcome-diagnosis.json","purpose":"Positive acceptance fixture for agent-job-outcome-diagnosis.json.","schema_ref":"schemas/v2/agent-job-outcome.schema.json","sha256":"3a57cf18e68853ee1d18704210cac8f9ade4a1807267ea94a792246d54ae87d6","size":4179},{"path":"positive/agent-job-outcome-draft-diagnosis.json","purpose":"Positive V2 diagnosis Agent draft before server finalization.","schema_ref":"schemas/v2/agent-job-outcome-draft.schema.json","sha256":"3f4a8b1d9ed57494f9a8d4ca1bc9f1712372713fd3af9313c608b8bf33dbd0f5","size":1911},{"path":"positive/agent-job-outcome-draft-failure.json","purpose":"Positive V2 failed Agent draft before server finalization.","schema_ref":"schemas/v2/agent-job-outcome-draft.schema.json","sha256":"b747ff9c05231520e0dd35bdc44eaee07d9f778b1c19f844186bfa3edd2a36f6","size":452},{"path":"positive/agent-job-outcome-draft-review.json","purpose":"Positive V2 blind-review Agent draft before server finalization.","schema_ref":"schemas/v2/agent-job-outcome-draft.schema.json","sha256":"cf1076d60b1339f0407a0ce59a57aed0d8e0ddd4b5a623b0820ea329537aa9f4","size":970},{"path":"positive/agent-job-outcome-draft-route.json","purpose":"Positive V2 route Agent draft before server finalization.","schema_ref":"schemas/v2/agent-job-outcome-draft.schema.json","sha256":"d92a163df9e7769d54716cf93de9fcf5997faa060544fc5164f95cad2b810c5f","size":544},{"path":"positive/agent-job-outcome-failure.json","purpose":"Positive acceptance fixture for agent-job-outcome-failure.json.","schema_ref":"schemas/v2/agent-job-outcome.schema.json","sha256":"b52c0eaa226936d602e1013c6d397c9642656b1aaa2e374d3a4274e6911d6820","size":531},{"path":"positive/agent-job-outcome-review.json","purpose":"Positive acceptance fixture for agent-job-outcome-review.json.","schema_ref":"schemas/v2/agent-job-outcome.schema.json","sha256":"1479de242214b4a67f031900826f041bd4d8332746155c92d9b65c36a18e9788","size":2441},{"path":"positive/agent-job-outcome-route.json","purpose":"Positive acceptance fixture for agent-job-outcome-route.json.","schema_ref":"schemas/v2/agent-job-outcome.schema.json","sha256":"1abe078bf50ac09c55f4f7e3023a9907a7d0984ba84b73dab10b4fa8328df42d","size":623},{"path":"positive/handoff.json","purpose":"Positive acceptance fixture for handoff.json.","schema_ref":"schemas/v2/handoff.schema.json","sha256":"54c96ca463e5879537ec214cb751566aba03b7528aaefc7d8a127c811e310d08","size":792},{"path":"positive/job-diagnose.json","purpose":"Positive acceptance fixture for job-diagnose.json.","schema_ref":"schemas/v2/job.schema.json","sha256":"13e277b01eb4ff7514ef636c00b556ea23dcc435903759a6978413a88c9a84a0","size":2386},{"path":"positive/job-outcome-diagnosis.json","purpose":"Positive acceptance fixture for job-outcome-diagnosis.json.","schema_ref":"schemas/v2/job-outcome.schema.json","sha256":"31d6d63187df68de47556fc09c46fc7e4ab1db1322ec1fa13466a68aced57ea1","size":4564},{"path":"positive/job-outcome-failure.json","purpose":"Positive acceptance fixture for job-outcome-failure.json.","schema_ref":"schemas/v2/job-outcome.schema.json","sha256":"fdccf15dd24bd309894781b372fab27a3df652eddd72007e3a68302a1291461f","size":518},{"path":"positive/job-outcome-review.json","purpose":"Positive acceptance fixture for job-outcome-review.json.","schema_ref":"schemas/v2/job-outcome.schema.json","sha256":"58ae72a2129689139e6f426347c0c1cd199687955fe9ae8a5a01958d1d1366e9","size":2428},{"path":"positive/job-outcome-route.json","purpose":"Positive acceptance fixture for job-outcome-route.json.","schema_ref":"schemas/v2/job-outcome.schema.json","sha256":"46c741faa7fdb6684ec816db0f2a6ae9b49da8f90cd380d0bc4c93d55e181820","size":610},{"path":"positive/job-review.json","purpose":"Positive acceptance fixture for job-review.json.","schema_ref":"schemas/v2/job.schema.json","sha256":"5eb6b0e986937017d2bc63b5019b5497f28ed0a33da9af1c83d7b26c0801b316","size":3265},{"path":"positive/job-route.json","purpose":"Positive acceptance fixture for job-route.json.","schema_ref":"schemas/v2/job.schema.json","sha256":"343818ab901a2d42c5c2e58b471224e3f62b0eef36e45ff26c76a741916f4b05","size":2051},{"path":"positive/logparse-parse-claim.json","purpose":"Positive acceptance fixture for logparse-parse-claim.json.","schema_ref":"schemas/v2/logparse-parse-claim.schema.json","sha256":"5697a0ead4a9898a02bea79518a4271a028ba6190b0e5294ef7d611f28a707fa","size":472},{"path":"positive/rpc-timeout-continuation.json","purpose":"Canonical RPC-timeout continuation seed covering parameter groups A/B and the unique log_archive requirement.","schema_ref":null,"sha256":"416fc897a7a53b208cbaa2804572bfdcfe7b3bbb64f0ab39e95ef6c28607074d","size":285},{"path":"positive/state.json","purpose":"Positive acceptance fixture for state.json.","schema_ref":"schemas/v2/state.schema.json","sha256":"144e638838781d31ff7291063864018cb6381b276579f3c3f8f2ad2a5261a0bb","size":3595},{"path":"positive/user-result.json","purpose":"Positive acceptance fixture for user-result.json.","schema_ref":"schemas/v2/user-result.schema.json","sha256":"f45604205d60aacb6df55376fc9793d0dcaf99ee02b3e58bd8ca692c1a2eac85","size":2299},{"path":"positive/workspace-input-manifest-review.json","purpose":"Positive V2 blind-review Workspace manifest with ReviewSubject and no previous Outcome.","schema_ref":"schemas/v2/workspace-input-manifest.schema.json","sha256":"46ec7a84e5af4e31a38b01fae5d7e38f2fcd5d5252104d9b633e8203616319d4","size":2150},{"path":"positive/workspace-input-manifest.json","purpose":"Positive acceptance fixture for workspace-input-manifest.json.","schema_ref":"schemas/v2/workspace-input-manifest.schema.json","sha256":"27ca2481f64a4b3bad20145be124cd396accccbe3507d29fe0b1489c62add91e","size":2590}],"owner_spec":"S00","root":"tests/fixtures/contracts","schema_version":1}
