{"files":[{"path":"SKILL.md","purpose":"Test-only preinstalled generic locator Skill that writes a fixed success result only when the exact multiline Unicode input contract is preserved.","schema_ref":null,"sha256":"862c9613410c61da248312101d24e75f752fbe3281218e536e9dc7e28ab2ccd7","size":2087},{"path":"agents/openai.yaml","purpose":"Skill interface metadata that disables implicit invocation for the isolated smoke fixture.","schema_ref":null,"sha256":"8a9c54089a97c60cc71f151aa749cd38dfa0fbf3dca06ba7ce1de21cce279c9a","size":273}],"owner_spec":"S08","root":"tests/fixtures/components/generic-problem-locator-smoke","schema_version":1}
