{"files":[{"path":"cross-project-result-experience.json","purpose":"Self-contained machine-readable Result experience baseline traced to frozen issue-locator and problem-locator-mcp source snapshots.","schema_ref":null,"sha256":"3ff614f3228ded49a17c4f9f154141fc5ca1d580752fc59094daf47fa5846f66","size":4258},{"path":"cross-project-sources/issue-locator-problem-locator-mcp-v1.0.1-skill.md","purpose":"Exact frozen issue-locator compatibility Skill fixture used as a flat archive, time relevance, and report-information experience source.","schema_ref":null,"sha256":"ec3440b1ca2612e7d34e646802ce236cd113eafba21844616d9c49d1267e574f","size":2122},{"path":"cross-project-sources/problem-locator-mcp-diagnose-service-skill.md","purpose":"Exact frozen problem-locator-mcp diagnosis Skill used as an evidence-gap and recommendation experience source.","schema_ref":null,"sha256":"13e5d696664b5b06fb2ae9b8f9a05cfbb786873f49747d74fe62a720899eef4b","size":5944},{"path":"cross-project-sources/problem-locator-mcp-generated-skill-contract.md","purpose":"Exact frozen problem-locator-mcp generated Skill contract defining legacy semantic log names, flat scope, and report content.","schema_ref":null,"sha256":"3d6f79eef00887a4588784b91f0a9f8d1659343d88e5d327e48ac710a3be6783","size":5475},{"path":"cross-project-sources/problem-locator-mcp-pack-result-zip.py","purpose":"Exact frozen problem-locator-mcp deterministic flat Result packer source.","schema_ref":null,"sha256":"0a5de3a135dc1cf4f11c71d01cdea0b11758860b0644a33f0a880cdd2e57e46e","size":1782},{"path":"expected-parse-counter.json","purpose":"Golden canonical proof that the RPC-timeout Case invokes logparse parse exactly once.","schema_ref":null,"sha256":"d394e8ae7989458b8c2686297a031614609cefeff2c8e76cdfb352e0655662a3","size":18},{"path":"expected-parse-manifest.json","purpose":"Golden canonical parse_manifest.json emitted for the synthetic compact RPC-timeout run.","schema_ref":null,"sha256":"4e34493ab9e6810527736aa4c225c576bc8a29bee029042f3ca058af56fcbe87","size":246},{"path":"expected-target-logs.json","purpose":"Golden canonical dual-anchor target-log result used by both first analysis and persisted-run reuse.","schema_ref":null,"sha256":"30181cccb748a3211da45e129a617054f7aa4fe2479687d5b5881dd06dda20d6","size":621},{"path":"fake_agent.py","purpose":"Deterministic Methods V1 Agent that emits grounded Specialist and independent Reviewer drafts from frozen target logs.","schema_ref":null,"sha256":"d54fbd43100908c35b330c0e5ab8f762e344f6c9a5eecac1db7c515fe44a6271","size":14298},{"path":"payment-inventory-rpc.zip","purpose":"Real deterministic ZIP containing only small non-sensitive synthetic payment and inventory RPC timeout logs plus a leak-test marker.","schema_ref":null,"sha256":"48096196e226f063b4cefb4f528eb66f4bcf34ada62e2b6a727f11fbb6e49287","size":946}],"owner_spec":"S08","root":"tests/fixtures/rpc_timeout","schema_version":1}
