{"files":[{"path":"expected-section-order.json","purpose":"Frozen section-kind order for ROUTE, DIAGNOSE, and REVIEW contexts.","schema_ref":null,"sha256":"0c9da73d0eda01ee6960748a1102063acf810c98cc8b4bec92bb3acf24ee0be8","size":499},{"path":"materials.json","purpose":"Resolved asset entry text used by deterministic context builder tests.","schema_ref":null,"sha256":"dd698fcb7298b8071fbbc6055c5f44c2fc86ee494587589a9710ffb95a3eda63","size":900},{"path":"unicode-evidence.txt","purpose":"UTF-8 Evidence summary used to distinguish byte counts from character counts.","schema_ref":null,"sha256":"91905bb08ef21503aab82170f8b1843eab4908161123ef52ea2202db2412b180","size":58}],"owner_spec":"S04","root":"tests/fixtures/components/runtime-context","schema_version":1}
