{"files":[{"path":"output-reader-cases.json","purpose":"Fixed endpoint/token and cross-chunk boundary values for output secret scanning tests.","schema_ref":null,"sha256":"f1176974ce28cdcc1747c850fc2c0084b285b6fd27d856d2540580dc83d925dc","size":171}],"owner_spec":"S04","root":"tests/fixtures/components/runtime-output","schema_version":1}
