{"files":[{"path":"scenarios/atomic-write-faults.json","purpose":"Enumerates atomic state write fault boundaries and the authoritative generation after each failure.","schema_ref":null,"sha256":"fdc208ddbb97193c13eff28ea7b74930749bb08d89ef823e694b3277694823f4","size":509},{"path":"scenarios/resource-hash-mismatch.json","purpose":"Describes a staged FILE whose declared digest does not match the one-read content bytes.","schema_ref":null,"sha256":"149646ed47b26b4d86275a45b5327bf54c33c614b44ff289484689a618f9c1ec","size":244},{"path":"scenarios/workspace-attachment-materialization-paths.json","purpose":"Freezes r3 attachment archive suffix derivation while formal FILE and DIRECTORY storage leaves remain unchanged.","schema_ref":null,"sha256":"ce4fe4be34a27b87165afb692208fb775fa35df8532b681341c2c940e4c8c720","size":788},{"path":"state/invalid-dangling-active-job.json","purpose":"Schema-valid current StateFile graph rejected because Case.active_job_id does not resolve a Job.","schema_ref":"schemas/v2/state.schema.json","sha256":"88bd4edd293d067666574d9877d03109dc15a67c14fafc88482db3899b541a78","size":1335},{"path":"state/invalid-r2-contract-revision.json","purpose":"Legacy StateFile rejected by the current State contract with no migration.","schema_ref":"schemas/v2/state.schema.json","sha256":"e3ffffd5555d5cd9cba51692eea781c5e91eda38d32e46ade9961eab170c6dec","size":299},{"path":"state/invalid-truncated.json","purpose":"Truncated StateFile bytes rejected before schema or model validation.","schema_ref":"schemas/v2/state.schema.json","sha256":"345d9e6fd2e670b38254c51022ece5775da39b924d09c67aa04cdc4b7836f53a","size":64},{"path":"state/invalid-unknown-schema-version.json","purpose":"Canonical StateFile envelope rejected for an unsupported legacy schema version.","schema_ref":"schemas/v2/state.schema.json","sha256":"d8e90b395f0e2f6141b1705004ebeb56381ead38303986f57e6b5f94ab211951","size":299},{"path":"state/valid-empty-v11.json","purpose":"Current V10 empty Case store snapshot.","schema_ref":"schemas/v2/state.schema.json","sha256":"f62398697c0ee1fbf5743c2cca2a47066e3707ac28f20cab4f5fd5b280a23b8f","size":301}],"owner_spec":"S02","root":"tests/fixtures/components/storage","schema_version":1}
