{"files":[{"path":"delivery-error-policy.json","purpose":"R3 method-specific submit retry, parked outbox, and Runtime state-fault policy.","schema_ref":null,"sha256":"052df2063d11399609f081985319170b06db44ea4ce8d1d0464debd9bc41b325","size":1632},{"path":"job-stage-matrix.json","purpose":"ROUTE, DIAGNOSE, and REVIEW case-stage claim matrix.","schema_ref":null,"sha256":"8d8d18054f7eabf40ff8a9bc7d23fbd1446b65f3bf6e62625bfd38ec05065ecf","size":356},{"path":"replacement-chain.json","purpose":"Same-stage REVIEW replacement identity chain for explicit Resume.","schema_ref":null,"sha256":"81b3004348d457adccbe2cb518a2c30a8543f6ef037edfd063d9ac7a742fdd9d","size":210},{"path":"startup-outbox.json","purpose":"R3 replay-before-interrupt, retry, park, repair, and state-fault recovery scenarios.","schema_ref":null,"sha256":"1557d19e4a3da39ce357c0cf7a2c960ed016a4a88dbce3c60feca678b427a422","size":3095}],"owner_spec":"S05","root":"tests/fixtures/components/dispatch-scheduler","schema_version":1}
