{"files":[{"path":"diagnose-service-takeover/SKILL.md","purpose":"Frozen TEST_ONLY Diagnosis Skill v4 generated from the synthetic service-takeover wiki.","schema_ref":null,"sha256":"93696715beeffe07950c00a4c6e302925491aa30a6a7c6b4e7b7fed688f2bac3","size":36862},{"path":"diagnose-service-takeover/diagnosis-skill.json","purpose":"Canonical TEST_ONLY manifest for the frozen synthetic service-takeover Skill.","schema_ref":null,"sha256":"09c8ffc2035571bc07b9acbba5c9fa4f91c2bca42983b55a49c0d889501c7b64","size":12724},{"path":"specs/database-deadlock.json","purpose":"GenerationSpec v4 TEST_ONLY fixture for database-deadlock parameter-isolation and lifecycle tests.","schema_ref":null,"sha256":"40203a0f249ee3a94ad6cab88dcdcffff623ed02b138624d4fbc31b6d1ccfd1f","size":7191},{"path":"specs/manual-triage.json","purpose":"GenerationSpec v4 TEST_ONLY fixture for manual-triage parameter-isolation and lifecycle tests.","schema_ref":null,"sha256":"44694c73da68078762c0c5b72d813fb2feb61d9188216b21a5f04fa4d8e31285","size":3228},{"path":"specs/rpc-service-takeover.json","purpose":"GenerationSpec v4 TEST_ONLY fixture for rpc-service-takeover parameter-isolation and lifecycle tests.","schema_ref":null,"sha256":"b1bb7fb2dc5ee9efdf9896957eddebdfccb7252a454dfcc3f26b7ee97fa299bb","size":20223}],"owner_spec":"S07","root":"tests/fixtures/components/diagnosis-generator","schema_version":1}
